{"witness_receipt":{"receipt_id":"pwr_2547ed912dbd76f1782440e7909b0d9d","tain":"tain_01M4C7CXTTTARBVWDT5Q60GZDY","node_id":"767-2676.com","protocol_id":"POPCORN-WITNESS/2.0","request_received_at_utc":"2026-10-07T22:22:58.528Z","witnessed_at_utc":"2026-10-07T22:22:59.418Z","statement_created_at_utc":"2026-10-07T22:22:59.418Z","unix_time_milliseconds":1791411779418,"clock_accuracy_radius_ms":10000,"witness_window_utc":{"earliest":"2026-10-07T22:22:49.418Z","latest":"2026-10-07T22:23:09.418Z"},"server_processing_duration_ms":890,"post_witness_processing_duration_ms":0,"commitment":{"payload_digest":{"algorithm":"sha-256","value":"WtMPqEDmIAlNRkC-mFNQZeoGt6CWxogfePJ1-PSEJ-E"},"nonce":"eM3EbD0f6WFxqfmPvZ-7QT-2QAKxuX1RlOjxQCg5UfQ","previous_attestation_digest":null},"payment_identifier":"eip3009_6cf05ce9e529dc19916b8202f6d12faf25ec2a7b461fd2736663b6571026d59a","payment_transaction":"0x154c9377197df24c92318aa699127a9e819eea586d7ade2c6fb7bfc637922bd5","evidence_scope":{"type":"payload_commitment_witness","payload_disclosed":false,"caller_identity_proven":false,"recipient_delivery_proven":false,"action_execution_proven":false,"nonce_uniqueness_enforced":false,"replay_prevented":false,"authorization_granted":false,"external_atomic_clock_alignment_proven":false,"clock_accuracy_independently_verified":false,"payer_authorization_bound_to_commitment":false},"issuing_origin":"https://767-2676.com","issuance_endpoint":"/v2/receipt","tain_verification_uri":"https://767-2676.com/v1/receipt/tain/tain_01M4C7CXTTTARBVWDT5Q60GZDY","contribution_license_uri":"https://767-2676.com/license/contribution/1.0","license_terms_digest":{"algorithm":"sha-256","value":"cR0ghOOH6DG3SEeoYxPw1b38oL2wf2IjTazGSxi-vIY"}},"witness_attestation":{"format":"JWS","algorithm":"ES256","key_id":"popcorn-witness-2026-01","key_set":"/.well-known/popcorn-keys.json","compact_jws":"eyJhbGciOiJFUzI1NiIsImtpZCI6InBvcGNvcm4td2l0bmVzcy0yMDI2LTAxIiwidHlwIjoicG9wY29ybi13aXRuZXNzK2p3cyJ9.eyJyZWNlaXB0X2lkIjoicHdyXzI1NDdlZDkxMmRiZDc2ZjE3ODI0NDBlNzkwOWIwZDlkIiwidGFpbiI6InRhaW5fMDFNNEM3Q1hUVFRBUkJWV0RUNVE2MEdaRFkiLCJub2RlX2lkIjoiNzY3LTI2NzYuY29tIiwicHJvdG9jb2xfaWQiOiJQT1BDT1JOLVdJVE5FU1MvMi4wIiwicmVxdWVzdF9yZWNlaXZlZF9hdF91dGMiOiIyMDI2LTEwLTA3VDIyOjIyOjU4LjUyOFoiLCJ3aXRuZXNzZWRfYXRfdXRjIjoiMjAyNi0xMC0wN1QyMjoyMjo1OS40MThaIiwic3RhdGVtZW50X2NyZWF0ZWRfYXRfdXRjIjoiMjAyNi0xMC0wN1QyMjoyMjo1OS40MThaIiwidW5peF90aW1lX21pbGxpc2Vjb25kcyI6MTc5MTQxMTc3OTQxOCwiY2xvY2tfYWNjdXJhY3lfcmFkaXVzX21zIjoxMDAwMCwid2l0bmVzc193aW5kb3dfdXRjIjp7ImVhcmxpZXN0IjoiMjAyNi0xMC0wN1QyMjoyMjo0OS40MThaIiwibGF0ZXN0IjoiMjAyNi0xMC0wN1QyMjoyMzowOS40MThaIn0sInNlcnZlcl9wcm9jZXNzaW5nX2R1cmF0aW9uX21zIjo4OTAsInBvc3Rfd2l0bmVzc19wcm9jZXNzaW5nX2R1cmF0aW9uX21zIjowLCJjb21taXRtZW50Ijp7InBheWxvYWRfZGlnZXN0Ijp7ImFsZ29yaXRobSI6InNoYS0yNTYiLCJ2YWx1ZSI6Ild0TVBxRURtSUFsTlJrQy1tRk5RWmVvR3Q2Q1d4b2dmZVBKMS1QU0VKLUUifSwibm9uY2UiOiJlTTNFYkQwZjZXRnhxZm1QdlotN1FULTJRQUt4dVgxUmxPanhRQ2c1VWZRIiwicHJldmlvdXNfYXR0ZXN0YXRpb25fZGlnZXN0IjpudWxsfSwicGF5bWVudF9pZGVudGlmaWVyIjoiZWlwMzAwOV82Y2YwNWNlOWU1MjlkYzE5OTE2YjgyMDJmNmQxMmZhZjI1ZWMyYTdiNDYxZmQyNzM2NjYzYjY1NzEwMjZkNTlhIiwicGF5bWVudF90cmFuc2FjdGlvbiI6IjB4MTU0YzkzNzcxOTdkZjI0YzkyMzE4YWE2OTkxMjdhOWU4MTllZWE1ODZkN2FkZTJjNmZiN2JmYzYzNzkyMmJkNSIsImV2aWRlbmNlX3Njb3BlIjp7InR5cGUiOiJwYXlsb2FkX2NvbW1pdG1lbnRfd2l0bmVzcyIsInBheWxvYWRfZGlzY2xvc2VkIjpmYWxzZSwiY2FsbGVyX2lkZW50aXR5X3Byb3ZlbiI6ZmFsc2UsInJlY2lwaWVudF9kZWxpdmVyeV9wcm92ZW4iOmZhbHNlLCJhY3Rpb25fZXhlY3V0aW9uX3Byb3ZlbiI6ZmFsc2UsIm5vbmNlX3VuaXF1ZW5lc3NfZW5mb3JjZWQiOmZhbHNlLCJyZXBsYXlfcHJldmVudGVkIjpmYWxzZSwiYXV0aG9yaXphdGlvbl9ncmFudGVkIjpmYWxzZSwiZXh0ZXJuYWxfYXRvbWljX2Nsb2NrX2FsaWdubWVudF9wcm92ZW4iOmZhbHNlLCJjbG9ja19hY2N1cmFjeV9pbmRlcGVuZGVudGx5X3ZlcmlmaWVkIjpmYWxzZSwicGF5ZXJfYXV0aG9yaXphdGlvbl9ib3VuZF90b19jb21taXRtZW50IjpmYWxzZX0sImlzc3Vpbmdfb3JpZ2luIjoiaHR0cHM6Ly83NjctMjY3Ni5jb20iLCJpc3N1YW5jZV9lbmRwb2ludCI6Ii92Mi9yZWNlaXB0IiwidGFpbl92ZXJpZmljYXRpb25fdXJpIjoiaHR0cHM6Ly83NjctMjY3Ni5jb20vdjEvcmVjZWlwdC90YWluL3RhaW5fMDFNNEM3Q1hUVFRBUkJWV0RUNVE2MEdaRFkiLCJjb250cmlidXRpb25fbGljZW5zZV91cmkiOiJodHRwczovLzc2Ny0yNjc2LmNvbS9saWNlbnNlL2NvbnRyaWJ1dGlvbi8xLjAiLCJsaWNlbnNlX3Rlcm1zX2RpZ2VzdCI6eyJhbGdvcml0aG0iOiJzaGEtMjU2IiwidmFsdWUiOiJjUjBnaE9PSDZERzNTRWVvWXhQdzFiMzhvTDJ3ZjJJalRhekdTeGktdklZIn19.rnWsKAz4MJct-U9N3fJP8eLaxxtCU1YavHvigZDFOiqp8vj7QlPrISpxWwejomMeGeB1Rd8HXtnq8VH-MWSPPw"},"payment_status":"settled","tain_qr_png_base64":"iVBORw0KGgoAAAANSUhEUgAAASQAAAEkCAAAAACjkhMwAAAGjElEQVR4nO3dwW7kSgxD0fz/T2c2QSOjkBTdGKAqg1ubuG1Zoo6Becv38clZz8fpAL/hgFQckIoDUnFAKg5IxQGpOCAVB6TigFQckIoDUnFAKg5IxQGpOD+QPsL5/lzVz3uzrw0R5rna7z23enfdzgUJJJDOIm3D1KAZeltuXqt3Vc02wwGomnpPkEAC6ThSE6qpS8u012leWtx9lKd7ggQSSPciqeezzi3hrh3Iu+/Pmg0WJJBA+v1IaaHZY6tTyzSLt7MTLEgggfQ7kNx91bwN4zASSqpJ/d3zdk+QQALpHqS0xP/0t/lYIIEE0lmk7agmabgKOOtU39RHva9ybJnrnR+/AFLxAkjFCyDpsG2oJoyCc8ct/b1XmyfN2UBBAgmks0ht0CdgDmXWp+v5/laTMBMcSCCBdA9SGrzVuKDueQJNKA67fe6yqd8ggQTSeSTV7AlCCuXqEmC7mIPZ8FUtSCCBdAeSWzAtPp+lXgnYQTUZ5/XWK+0FEkgg3YWUBs+hafENctal0Oq6mefecbuABBJIdyJtwdw7CdzNaO+9c516qgMSSCDdhTQHtAu6v+6eC/2k/9avQVfzQQIJpPuQGpgtXKrbgjvA9DHVUXupnuoZSCCBdB7JDVBN3YIuoOub0BSQmp3AU3/VFySQQLoPKQXaAN1vBe1mqlq39JYlgbq+IIEE0h1IDiYNc+9vOM3ctECqTx/BZbU1IIEE0jGkFqcBTYumxV0WlSH1e+daQYEEEkjnkNJg2yQAbouk92dNAk/Z1TsOCCSQQLobSQ1UtU+XdDNdDrekytoi1dlAAgmk40gqgAqmkBqMJrSrezIz4aYMIIEE0h1ICcYFiAPMP/TpIzR1zcLuWvWPHw0kkEC6DsmFcoNcTRPUYSuwBKd+O8g4GySQQDqOlFDc4FSjFlV9HIDLpbK7ngk0ooMEEkjHkJqFXJj2evvdYiS87WO4GmkBEkggHUdqgqrT9nHhNkhXn2a0yCCNHNv1X/UbkAoyw4MEUv8/wUuBttr0t3kvwdjFipwqh+oHEkggnUNSwxJEAlHXTxaZ77g+Ko+7t82QfUECCaSjSE3QBNOgbMs3tdtHUPVpjs2dGoP0dT81BunrfmoM0td91XgGUH/T9RyqQk7QbZ5aRn2QVO/6OmCQQALpPNJ8Qf1ONQ4k9XA938Vw9WkOSCCBdCdSCtg0nEuopSbgNmvWpsypvtlH9QcJJJDuQdqCzFCqVgVIGA7WYT8B2uZID5BAAukokgtpm5R1KWCD03y0DUl9XPX+X3M8EUivZ54IpNczTwTS61kKmEInhHnaZ2n+9nvL6j5O84FBAgmks0iqeFtsC6GeNfPU9ey39VW9XE+QQALpPqRteAPhlnUArqZFntcbYrPf617TCKSiEUhFI5CKRnN4CpneaYDVO65GPXfg2x4ggQTSnUhbuHZ59V4TeEN3Gbberr97BySQQLoLaQvugmzhHGh6T81NmOpvk2fWgwQSSPcgNTCu+Vyk6dcspxZy/V1ONwMkkEC6E2lb0C20HTXDzXX3HK6DSjiuFiSQQLobSb2olnTDVV37bMvg+jQfoYUFCSSQziKlpimIGqpqm6VVv4Sveqps244OCiSQQDqHlJpvMClM6q+WT+FTvfsYbVZ1QAIJpHNIakHVNC2zQWzh/8XsBKj6qH4ggQTSeSS3VGqeFlJ1MdDyD/eTOe40HwAkkEC6G8kNU++492Z9Ap5/G9htj3StcoIEEkjnkVQwF2ZDUz3T8huMe75BPwEGCSSQ7kJy4WcYB9DAuRqVpUVq6lsokEAC6R6kFPLJwi5sAmoWVBAJY6tPHwAkkEC6B2lr3C6uBjchVZ8NVOXboNW7IIEE0j1IqrkKkIJsyE1gF3oDd7+3d9WHAAkkkM4jpaUUolrELbgtr8DSki7fltXNsbuABBJIR5HSUY0Tygbybs32AdTybk7K/wkSSCAdRVJNt7AuvAvrZqnQ6v6GlHJu/VRfkEAC6SxSGr6hKpwt5FxILemeqT7bu+63fQckkEA6jpSWSlAb3JNnar7K2Sy99U8HJJBAuhfpybO0iArn+rWQqv9Wl/KABBJIvwdJNgv/yDfX7l4z7wmmm2k/HkgggXQcqQnuGiuEeS+F2hZPizb1KTdIIIF0H5I7bkCLpd6L4cR/CFpUV+/2cfAggQTSWSTOzwNScUAqDkjFAak4IBUHpOKAVByQigNScUAqDkjFAak4IBUHpOKAVJw/CxB2TULwWAkAAAAASUVORK5CYII=","tain_qr_payload":"{\"v\":1,\"tain\":\"tain_01M4C7CXTTTARBVWDT5Q60GZDY\",\"license_uri\":\"https://767-2676.com/license/contribution/1.0\",\"terms_digest\":\"cR0ghOOH6DG3SEeoYxPw1b38oL2wf2IjTazGSxi-vIY\",\"verify_uri\":\"https://767-2676.com/v1/receipt/tain/tain_01M4C7CXTTTARBVWDT5Q60GZDY\"}","letterhead_uri":"https://767-2676.com/v1/receipt/tain/tain_01M4C7CXTTTARBVWDT5Q60GZDY"}