{"witness_receipt":{"receipt_id":"pwr_eb7e440aaff765e9d803c42d96c171c6","tain":"tain_01M4YBT3FSPW08EWE0MGPN2WCT","node_id":"767-2676.com","protocol_id":"POPCORN-WITNESS/2.0","request_received_at_utc":"2026-10-14T23:26:24.611Z","witnessed_at_utc":"2026-10-14T23:26:25.273Z","statement_created_at_utc":"2026-10-14T23:26:25.273Z","unix_time_milliseconds":1792020385273,"clock_accuracy_radius_ms":10000,"witness_window_utc":{"earliest":"2026-10-14T23:26:15.273Z","latest":"2026-10-14T23:26:35.273Z"},"server_processing_duration_ms":662,"post_witness_processing_duration_ms":0,"commitment":{"payload_digest":{"algorithm":"sha-256","value":"A-7NHtiGbYFuGDg0-_f5RUPsyhjQoa3A87eYJS5gWKI"},"nonce":"WRfPcCqfujj3OOXHMoirn9VKbfhNf99gNeTHGXQ1SII","previous_attestation_digest":null},"payment_identifier":"eip3009_13c0c153b3cf487a435926de8d139a04ec89da73fc212b1487fda0c0d3cb1635","payment_transaction":"0xc08bd6855e545099070e3657f12c040a6983076b185a5ee069ac3865a492bd7f","evidence_scope":{"type":"payload_commitment_witness","payload_disclosed":false,"caller_identity_proven":false,"recipient_delivery_proven":false,"action_execution_proven":false,"nonce_uniqueness_enforced":false,"replay_prevented":false,"authorization_granted":false,"external_atomic_clock_alignment_proven":false,"clock_accuracy_independently_verified":false,"payer_authorization_bound_to_commitment":false},"issuing_origin":"https://767-2676.com","issuance_endpoint":"/v2/receipt","tain_verification_uri":"https://767-2676.com/v1/receipt/tain/tain_01M4YBT3FSPW08EWE0MGPN2WCT","contribution_license_uri":"https://767-2676.com/license/contribution/1.0","license_terms_digest":{"algorithm":"sha-256","value":"cR0ghOOH6DG3SEeoYxPw1b38oL2wf2IjTazGSxi-vIY"}},"witness_attestation":{"format":"JWS","algorithm":"ES256","key_id":"popcorn-witness-2026-01","key_set":"/.well-known/popcorn-keys.json","compact_jws":"eyJhbGciOiJFUzI1NiIsImtpZCI6InBvcGNvcm4td2l0bmVzcy0yMDI2LTAxIiwidHlwIjoicG9wY29ybi13aXRuZXNzK2p3cyJ9.eyJyZWNlaXB0X2lkIjoicHdyX2ViN2U0NDBhYWZmNzY1ZTlkODAzYzQyZDk2YzE3MWM2IiwidGFpbiI6InRhaW5fMDFNNFlCVDNGU1BXMDhFV0UwTUdQTjJXQ1QiLCJub2RlX2lkIjoiNzY3LTI2NzYuY29tIiwicHJvdG9jb2xfaWQiOiJQT1BDT1JOLVdJVE5FU1MvMi4wIiwicmVxdWVzdF9yZWNlaXZlZF9hdF91dGMiOiIyMDI2LTEwLTE0VDIzOjI2OjI0LjYxMVoiLCJ3aXRuZXNzZWRfYXRfdXRjIjoiMjAyNi0xMC0xNFQyMzoyNjoyNS4yNzNaIiwic3RhdGVtZW50X2NyZWF0ZWRfYXRfdXRjIjoiMjAyNi0xMC0xNFQyMzoyNjoyNS4yNzNaIiwidW5peF90aW1lX21pbGxpc2Vjb25kcyI6MTc5MjAyMDM4NTI3MywiY2xvY2tfYWNjdXJhY3lfcmFkaXVzX21zIjoxMDAwMCwid2l0bmVzc193aW5kb3dfdXRjIjp7ImVhcmxpZXN0IjoiMjAyNi0xMC0xNFQyMzoyNjoxNS4yNzNaIiwibGF0ZXN0IjoiMjAyNi0xMC0xNFQyMzoyNjozNS4yNzNaIn0sInNlcnZlcl9wcm9jZXNzaW5nX2R1cmF0aW9uX21zIjo2NjIsInBvc3Rfd2l0bmVzc19wcm9jZXNzaW5nX2R1cmF0aW9uX21zIjowLCJjb21taXRtZW50Ijp7InBheWxvYWRfZGlnZXN0Ijp7ImFsZ29yaXRobSI6InNoYS0yNTYiLCJ2YWx1ZSI6IkEtN05IdGlHYllGdUdEZzAtX2Y1UlVQc3loalFvYTNBODdlWUpTNWdXS0kifSwibm9uY2UiOiJXUmZQY0NxZnVqajNPT1hITW9pcm45VktiZmhOZjk5Z05lVEhHWFExU0lJIiwicHJldmlvdXNfYXR0ZXN0YXRpb25fZGlnZXN0IjpudWxsfSwicGF5bWVudF9pZGVudGlmaWVyIjoiZWlwMzAwOV8xM2MwYzE1M2IzY2Y0ODdhNDM1OTI2ZGU4ZDEzOWEwNGVjODlkYTczZmMyMTJiMTQ4N2ZkYTBjMGQzY2IxNjM1IiwicGF5bWVudF90cmFuc2FjdGlvbiI6IjB4YzA4YmQ2ODU1ZTU0NTA5OTA3MGUzNjU3ZjEyYzA0MGE2OTgzMDc2YjE4NWE1ZWUwNjlhYzM4NjVhNDkyYmQ3ZiIsImV2aWRlbmNlX3Njb3BlIjp7InR5cGUiOiJwYXlsb2FkX2NvbW1pdG1lbnRfd2l0bmVzcyIsInBheWxvYWRfZGlzY2xvc2VkIjpmYWxzZSwiY2FsbGVyX2lkZW50aXR5X3Byb3ZlbiI6ZmFsc2UsInJlY2lwaWVudF9kZWxpdmVyeV9wcm92ZW4iOmZhbHNlLCJhY3Rpb25fZXhlY3V0aW9uX3Byb3ZlbiI6ZmFsc2UsIm5vbmNlX3VuaXF1ZW5lc3NfZW5mb3JjZWQiOmZhbHNlLCJyZXBsYXlfcHJldmVudGVkIjpmYWxzZSwiYXV0aG9yaXphdGlvbl9ncmFudGVkIjpmYWxzZSwiZXh0ZXJuYWxfYXRvbWljX2Nsb2NrX2FsaWdubWVudF9wcm92ZW4iOmZhbHNlLCJjbG9ja19hY2N1cmFjeV9pbmRlcGVuZGVudGx5X3ZlcmlmaWVkIjpmYWxzZSwicGF5ZXJfYXV0aG9yaXphdGlvbl9ib3VuZF90b19jb21taXRtZW50IjpmYWxzZX0sImlzc3Vpbmdfb3JpZ2luIjoiaHR0cHM6Ly83NjctMjY3Ni5jb20iLCJpc3N1YW5jZV9lbmRwb2ludCI6Ii92Mi9yZWNlaXB0IiwidGFpbl92ZXJpZmljYXRpb25fdXJpIjoiaHR0cHM6Ly83NjctMjY3Ni5jb20vdjEvcmVjZWlwdC90YWluL3RhaW5fMDFNNFlCVDNGU1BXMDhFV0UwTUdQTjJXQ1QiLCJjb250cmlidXRpb25fbGljZW5zZV91cmkiOiJodHRwczovLzc2Ny0yNjc2LmNvbS9saWNlbnNlL2NvbnRyaWJ1dGlvbi8xLjAiLCJsaWNlbnNlX3Rlcm1zX2RpZ2VzdCI6eyJhbGdvcml0aG0iOiJzaGEtMjU2IiwidmFsdWUiOiJjUjBnaE9PSDZERzNTRWVvWXhQdzFiMzhvTDJ3ZjJJalRhekdTeGktdklZIn19.aSnGyJM5C_J5ttZrTYLEezT0TeQR7dhPg-X7B1-mAFarOH81Owlu1Rjc7bDjmDRyv6iCzwATuPAkWKOFxJf4BQ"},"payment_status":"settled","tain_qr_png_base64":"iVBORw0KGgoAAAANSUhEUgAAASQAAAEkCAAAAACjkhMwAAAGcElEQVR4nO3U0U4EMQxDUf7/p+F1FWzHsyC1oNsXZmfaxDmV+PhkrevjdIC/sEAqFkjFAqlYIBULpGKBVCyQigVSsUAqFkjFAqlYIBULpGKBVKxvSB9hvX5X++e7Wded2XqofK81t/1bBjUnSCCBdA/S1iwNu+1VQ6kaCsHt2/a7mvWcIIEE0nGkJlSzrxlm6+36bZej+qi/Kz5IIIF0LZL6Pve54d3zBvuT8yojSCCB9P+Q3FJg2z41THMpCkf1TrAggQTS30BKeFvo1NSdU/scqENx+C5HmhMkkEC6B2kD+C9/m8sCCSSQziJtazZz39Ue9dvVSxc0v7uaqfeTBVKxQCoWSMVai70GdKHU3rRnDu5WqvlpQFQN903tk31AAgmko0hb4DT8rOcgJ0DznJBdvTj8AgYSSCCdR2oab0FVQ1Uv4aZebZ8WecUECSSQjiKpYm7PLOww0kW4nhNiG8zBqZ7bXpBAAukOpDnwFlI1cs1nQFdrQ05n5jdXK+UGCSSQ7kJKQ7jgqYb69g7afG7quDMqK0gggXQvUirQvN9+twP+9DnVTBcHEkgg3YXkDqpn1bh9P/e4wdTfdBHuXDoLEkgg3YukILYQDjmhquc0lMqaluuf5gMJJJDuQUpDbEE3ABtiOZMuYsNv86nfIIEE0nkktUkFcYM8DbxdRFsjzbFlUXVBAgmku5DSMLPQO6Hdnga32Z8u4XF2kEAC6ShSapKGeILSnkuXpjK6vu2zzAoSSCAdQ1LDJ5StiQNSv9XelKlFU2dcdpBAAukuJDeUa7KhzEFskPCu6e/6JKRtPpBAAukOJBXGBXuKmvqkHqlOqpdwUwaQQALpDiRVeAvgfruBGkh1Ec2FbJiqzwYGEkggnUVqh3PDqsFSiHe+P4VT2VQ+2RskkEC6Bkk1UhAptKqZ3qt96kyqs+EoUJcfJJBAOoeUDqXG6vnp8OoiHPiG11xqggYJJJDuQUoALozao2orKNV3q+2ypctREM2lgAQSSOeQFIIK4AZqwioQd65Bdfm3nO5iQAIJpDuRGogEop43HLc2NAe3gag6IIEE0l1IqYgLv51z4RWiQ3BQaViH3OYACSSQziPNgWegbehUwyG7Pq6vu5C039V1wCCBBNJ5pBTOFXUhXY20N0G0GG5/6gMSSCDdiaTCu8axsIHcBlC9EqYaNu3f5lH1QQIJpPNIcrMIMkOlGu6MOq+Gano5oA1OOYAEEkh3IDWF075mr0OYe7YMDk/VTEApN0gggfTte9r/q0izWXp2CHM13+YeN5z7vQ3d1pGZQAIJpKNIarNq7gKloZ/0Sz1nLvWsLsS9UzVAAgmkO5DcO9UoDZ8GdLWaHgpjPqf86T1IIIF0N5IK3yK4Wimg+p0yuTNulhUEJJBAugppNm8Gc2gpeKqdAJtcG9z2DBJIIN2HlDBUqDnIFrZFSD22nK6HyqoygQQSSPcgbYFVMVcnDaCGSYBtzpTP9QQJJJDuQ0pNXdB0Vg3ZDOzOKVx3NuG4vSCBBNLdSGrgDWi+a6FcFhW+AXdzPc0DEkggnUNSUG7gBtYF24Zua86z810CSDlAAgmke5DU8BuGAtkGaod3zy6bgtuyRweQQALpCiTVfAuZAGZdF1713vq3eVwGVQ8kkEC6A8k1S8OpMNswMtAbfeceh++yqj4ggQTSPUgu1Hyfwij0edYNpPoouDiYQXHPLjtIIIF0FkltSoipkYNO5xOM+75BPwEGCSSQ7kLaDm+IM2QCdMFnrQap2e96rjOBBBJIx5CaAm7g9tt8dsBuwFSzzdNcAEgggXQeyQVum6Y6E35DcdncWZWvwVPfQQIJpDuQVHEVQAVJwZpabo/Ll/okrASiFkgggXQOaRZwf38LJ6GpwVRW1dehpItxcCCBBNJZpLQ2lG3/DPzuHtVrw3B9Ur1PkEAC6SjSVnw+p0YO0/VS6G0v1+dpPVUXJJBAOouUmrtALWS6jA04fdvqtbVAAgmkO5HU4AlLIaV3zTcb+iHg1iMhggQSSHcjPfmmvr/uSb2b4dKgag4H4vKABBJIfwdJFgv/5LfnVH8Okc40mO6CHBZIIIF0Hml7r5o/QUihJsyTQZv9KTdIIIF0H5JbrkGLZUOE92r4BtXtd/PMvCCBBNIdSKzvC6RigVQskIoFUrFAKhZIxQKpWCAVC6RigVQskIoFUrFAKhZIxQKpWF+vCVdew8+hTQAAAABJRU5ErkJggg==","tain_qr_payload":"{\"v\":1,\"tain\":\"tain_01M4YBT3FSPW08EWE0MGPN2WCT\",\"license_uri\":\"https://767-2676.com/license/contribution/1.0\",\"terms_digest\":\"cR0ghOOH6DG3SEeoYxPw1b38oL2wf2IjTazGSxi-vIY\",\"verify_uri\":\"https://767-2676.com/v1/receipt/tain/tain_01M4YBT3FSPW08EWE0MGPN2WCT\"}","letterhead_uri":"https://767-2676.com/v1/receipt/tain/tain_01M4YBT3FSPW08EWE0MGPN2WCT"}
